{
  "tasks": [
    {
      "id": "e83aadf1-5057-43e7-899d-9d0d768ff004",
      "title": "Screenshots der Reisekostenabrechnungsapplikation an Ashik senden",
      "description": "",
      "completed": false,
      "tags": [
        "arbeit"
      ],
      "subtasks": [],
      "columnId": "date-2025-08-01",
      "createdAt": "2025-07-14T08:17:21.222Z",
      "updatedAt": "2025-07-31T12:31:01.039Z",
      "position": 14,
      "kanbanColumnId": "col-1752561672157-g38e1xha4",
      "reminderDate": "2025-08-01",
      "estimatedTime": 30,
      "linkedNotes": [
        "1753868924485969kvl9um"
      ]
    },
    {
      "id": "6b342c74-ae12-4cd7-8680-41cef061e562",
      "title": "Sitzplan anpassen",
      "description": "## Nachricht von Jonas\n- Hi Malte, ich glaube Juan Carlos fehlt in dem seating plan.\n- Und Thiago glaube ich sollte eigentlich Thibaut heiÃŸen",
      "completed": false,
      "estimatedTime": 25,
      "tags": [],
      "subtasks": [],
      "columnId": "project-1752561187805-9xtzj8v39",
      "createdAt": "2025-07-14T08:18:04.110Z",
      "updatedAt": "2025-07-31T12:27:31.610Z",
      "position": 5,
      "success": true,
      "task": {
        "title": "Sitzplan anpassen",
        "description": "## Nachricht von Jonas - Hi Malte, ich glaube Juan Carlos fehlt in dem seating plan. - Und Thiago glaube ich sollte eigentlich Thibaut heiÃŸen",
        "tags": []
      },
      "errors": [],
      "suggestions": [
        "Tipp: Verwenden Sie ! fÃ¼r niedrige, !! fÃ¼r mittlere oder !!! fÃ¼r hohe PrioritÃ¤t",
        "Tipp: Verwenden Sie #tags zur Organisation (z.B. #arbeit, #privat)",
        "Tipp: Geben Sie eine ZeitschÃ¤tzung an (z.B. 30m, 1h, 90min)",
        "Tipp: Verwenden Sie @heute, @morgen oder @inbox zur expliziten Spalten-Zuordnung"
      ],
      "linkedNotes": [],
      "kanbanColumnId": "col-1752561731913-q9e4bm5aa",
      "projectId": "project-1752561187805-9xtzj8v39"
    },
    {
      "id": "278fac85-45da-44d7-9896-ca9abf851068",
      "title": "Mit Ashik Ã¼ber Windows-Upgrades sprechen",
      "description": "",
      "completed": false,
      "tags": [
        "arbeit"
      ],
      "subtasks": [],
      "columnId": "date-2025-08-01",
      "createdAt": "2025-07-14T08:18:55.738Z",
      "updatedAt": "2025-07-31T12:31:01.039Z",
      "position": 9,
      "kanbanColumnId": "col-1752561731913-q9e4bm5aa",
      "reminderDate": "2025-08-01",
      "estimatedTime": 10,
      "linkedNotes": [],
      "dueDate": "2025-08-01",
      "projectId": "project-1752561187805-9xtzj8v39"
    },
    {
      "id": "1ea479c5-b72c-4681-8d44-86e05a2f5c26",
      "title": "Neue Visitenkarten bestellen",
      "description": "J.\n- 100 StÃ¼ck\n- en",
      "completed": true,
      "estimatedTime": 45,
      "tags": [],
      "subtasks": [],
      "columnId": "date-2025-07-21",
      "createdAt": "2025-07-14T08:19:02.383Z",
      "updatedAt": "2025-07-21T10:20:59.509Z",
      "position": 3,
      "linkedNotes": [],
      "reminderDate": "2025-07-21",
      "trackedTime": 37,
      "reminderTime": "16:27"
    },
    {
      "id": "eeb79373-7f27-4887-af8e-3e88617cda86",
      "title": "Anpassungen an Webseite Unique Wood machen",
      "description": "## Mail von Andrea\nHallo Malte,\n\nich hoffe, es geht dir gut. KÃ¶nntest du mir bitte dabei helfen, unsere Ã¶ffentliche Zusammenfassung des Waldbewirtschaftungsplans 2024 von Forestal Apepu, die ich dir im Anhang schicke, auf die Website von UNIQUE Wood hochzuladen?\n\nVielen Dank im Voraus.\nViele GrÃ¼ÃŸe,\n\n\n[ðŸ“§ Mail](https://outlook.office.com/owa/?ItemID=AAkALgAAAAAAHYQDEapmEc2byACqAC%2FEWg0A3giTJBGu5Eanj%2B1b%2BQowoAAFQY41FgAA&viewmodel=ReadMessageItem&path=&exvsurl=1) (9.7.2025)",
      "completed": true,
      "estimatedTime": 20,
      "tags": [],
      "subtasks": [],
      "columnId": "date-2025-07-15",
      "createdAt": "2025-07-14T08:19:54.644Z",
      "updatedAt": "2025-07-15T06:45:20.766Z",
      "position": 1752481194645,
      "linkedNotes": [],
      "kanbanColumnId": "col-1752561672157-g38e1xha4",
      "reminderDate": "2025-07-15",
      "projectId": "project-1752561187805-9xtzj8v39"
    },
    {
      "id": "1e9e508d-a4e7-40d1-b510-ec75690340a1",
      "title": "Migration Nextcloud zu Hetzner vorbereiten",
      "description": "",
      "completed": false,
      "tags": [],
      "subtasks": [
        {
          "id": "subtask-1753863648571-mbdphom7w",
          "title": "Preise chekcen",
          "description": "",
          "completed": false,
          "trackedTime": 0,
          "tags": [],
          "createdAt": "2025-07-30T08:20:48.571Z",
          "updatedAt": "2025-07-30T08:20:48.571Z"
        },
        {
          "id": "subtask-1753863654160-saz73tzxz",
          "title": "Abstimmung mit Ashik",
          "description": "",
          "completed": false,
          "trackedTime": 0,
          "tags": [],
          "createdAt": "2025-07-30T08:20:54.160Z",
          "updatedAt": "2025-07-30T08:20:54.160Z"
        },
        {
          "id": "subtask-1753863660888-s02hu4fsk",
          "title": "Migrationsplan erstellen",
          "description": "",
          "completed": false,
          "trackedTime": 0,
          "tags": [],
          "createdAt": "2025-07-30T08:21:00.888Z",
          "updatedAt": "2025-07-30T08:21:00.888Z"
        },
        {
          "id": "subtask-1753863672809-4gi1f886g",
          "title": "",
          "description": "",
          "completed": false,
          "trackedTime": 0,
          "tags": [],
          "createdAt": "2025-07-30T08:21:12.809Z",
          "updatedAt": "2025-07-30T08:21:12.809Z"
        }
      ],
      "columnId": "project-1752561187805-9xtzj8v39",
      "createdAt": "2025-07-14T08:21:47.131Z",
      "updatedAt": "2025-07-31T12:27:39.514Z",
      "position": 2,
      "kanbanColumnId": "col-1752561188719-g4l45kms7",
      "estimatedTime": 50,
      "linkedNotes": [],
      "projectId": "project-1752561187805-9xtzj8v39"
    },
    {
      "id": "237a19ac-be47-4e1a-9955-dd5816e1ec81",
      "title": "Bei Michael wegen Proxmox nachhaken",
      "description": "",
      "completed": false,
      "tags": [
        "arbeit"
      ],
      "subtasks": [],
      "columnId": "date-2025-08-01",
      "createdAt": "2025-07-14T08:21:51.428Z",
      "updatedAt": "2025-07-31T12:31:01.039Z",
      "position": 6,
      "kanbanColumnId": "col-1752561188719-g4l45kms7",
      "reminderDate": "2025-08-01",
      "estimatedTime": 10,
      "linkedNotes": [],
      "dueDate": "2025-07-31",
      "pinColumnId": "pin-1753871514451-aqkam29kx",
      "pinned": true
    },
    {
      "id": "0e85297e-d620-470d-8d7c-888e48d3f742",
      "title": "Grayson Webb auf Webseite stellen",
      "description": "",
      "completed": false,
      "tags": [
        "arbeit"
      ],
      "subtasks": [],
      "columnId": "date-2025-08-01",
      "createdAt": "2025-07-14T08:22:03.947Z",
      "updatedAt": "2025-07-31T12:31:01.039Z",
      "position": 5,
      "estimatedTime": 20,
      "reminderDate": "2025-08-01",
      "linkedNotes": []
    },
    {
      "id": "b625515d-8d21-4d1d-98d4-6d84ef4704ef",
      "title": "Intrexx-Anpassungen von Dennis planen",
      "description": "[ðŸ“§ Mail](https://outlook.office.com/owa/?ItemID=AAkALgAAAAAAHYQDEapmEc2byACqAC%2FEWg0A3giTJBGu5Eanj%2B1b%2BQowoAAFL0Ei8gAA&viewmodel=ReadMessageItem&path=&exvsurl=1) (27.6.2025)",
      "completed": false,
      "estimatedTime": 30,
      "tags": [],
      "subtasks": [],
      "columnId": "project-1752561187805-9xtzj8v39",
      "createdAt": "2025-07-14T08:22:42.182Z",
      "updatedAt": "2025-07-31T12:27:31.610Z",
      "position": 0,
      "linkedNotes": [],
      "kanbanColumnId": "col-1752561188719-g4l45kms7",
      "projectId": "project-1752561187805-9xtzj8v39"
    },
    {
      "id": "e123c844-6130-469f-97c9-da6e2f3e2e42",
      "title": "KI-Strategie Ã¼berarbeiten",
      "description": "",
      "completed": false,
      "estimatedTime": 0,
      "tags": [],
      "subtasks": [],
      "columnId": "project-1752481231598-z9g5g889y",
      "projectId": "project-1752481231598-z9g5g889y",
      "kanbanColumnId": "col-1752481233216-q0tncg668",
      "createdAt": "2025-07-14T08:27:07.209Z",
      "updatedAt": "2025-07-15T06:29:15.160Z",
      "position": 1752481596960,
      "linkedNotes": []
    },
    {
      "id": "76125068-4c73-4ac7-873c-94b540cf82ce",
      "title": "Unique Wood: Server mit RustDesk",
      "description": "",
      "completed": true,
      "estimatedTime": 30,
      "tags": [],
      "subtasks": [],
      "columnId": "date-2025-07-15",
      "reminderDate": "2025-07-15",
      "createdAt": "2025-07-15T06:43:45.737Z",
      "updatedAt": "2025-07-15T08:56:32.752Z",
      "position": 1752481627211,
      "trackedTime": 15.533333333333685,
      "completedAt": "2025-07-15T08:56:32.752Z"
    },
    {
      "id": "af3a91c6-cd85-4692-ba80-baab7762ab1c",
      "title": "VorstellungsgesprÃ¤ch vorbereiten",
      "description": "",
      "completed": true,
      "estimatedTime": 20,
      "tags": [],
      "subtasks": [],
      "columnId": "date-2025-07-15",
      "reminderDate": "2025-07-15",
      "createdAt": "2025-07-15T06:45:17.875Z",
      "updatedAt": "2025-07-15T06:45:20.766Z",
      "position": 1752481194644,
      "trackedTime": 0
    },
    {
      "id": "385010f8-610b-4e21-ae78-ab648f9d22d6",
      "title": "Mail an MA schreiben",
      "description": "Vielen Dank ...\nStrategie liegt im Ordner ...",
      "completed": true,
      "priority": "high",
      "estimatedTime": 45,
      "tags": [],
      "subtasks": [
        {
          "id": "subtask-1753086456056-9eejylqy2",
          "title": "Strategie in Ordner legen",
          "description": "",
          "completed": false,
          "estimatedTime": 0,
          "trackedTime": 0,
          "tags": [],
          "createdAt": "2025-07-21T08:27:36.056Z",
          "updatedAt": "2025-07-21T08:27:36.056Z"
        },
        {
          "id": "subtask-1753086469339-433u9n7cx",
          "title": "Mail mit Link versenden",
          "description": "",
          "completed": false,
          "estimatedTime": 0,
          "trackedTime": 0,
          "tags": [],
          "createdAt": "2025-07-21T08:27:49.339Z",
          "updatedAt": "2025-07-21T08:27:49.339Z"
        }
      ],
      "columnId": "date-2025-07-21",
      "projectId": "project-1752481231598-z9g5g889y",
      "kanbanColumnId": "col-1752481233216-q0tncg668",
      "dueDate": "2025-07-21",
      "reminderDate": "2025-07-21",
      "createdAt": "2025-07-21T08:27:27.233Z",
      "updatedAt": "2025-07-21T09:38:59.579Z",
      "position": 2,
      "linkedNotes": [],
      "trackedTime": 27
    },
    {
      "id": "c15fc727-b5f7-4cde-aae5-ed45578b471b",
      "title": "Bewerberprofile anschauen fÃ¼r Mittwoch",
      "description": "",
      "completed": true,
      "estimatedTime": 25,
      "tags": [],
      "subtasks": [],
      "columnId": "date-2025-07-23",
      "dueDate": "2025-07-21",
      "reminderDate": "2025-07-23",
      "createdAt": "2025-07-21T08:28:59.536Z",
      "updatedAt": "2025-07-23T15:32:40.802Z",
      "position": 1,
      "linkedNotes": [],
      "deadline": "2025-07-22",
      "archived": true
    },
    {
      "id": "17271e2c-9bf1-45a4-93ca-8c16d3543133",
      "title": "Intrexx-Sitzung vorbereiten",
      "description": "",
      "completed": true,
      "estimatedTime": 60,
      "tags": [],
      "subtasks": [],
      "columnId": "date-2025-07-23",
      "dueDate": "2025-07-22",
      "reminderDate": "2025-07-23",
      "createdAt": "2025-07-21T08:29:18.594Z",
      "updatedAt": "2025-07-23T15:32:40.802Z",
      "position": 0,
      "linkedNotes": [],
      "trackedTime": 30,
      "archived": true
    },
    {
      "id": "53686ac6-47db-4fef-911d-96b2c623fdb7",
      "title": "Rechner bestellen",
      "description": "We need 3 PCs for Canopea:\n\nThomas Ruf: German keyboard. [UNIQUE Helpdesk](https://unique.zammad.com/#ticket/zoom/5083)",
      "completed": true,
      "estimatedTime": 20,
      "tags": [
        "canopea"
      ],
      "subtasks": [],
      "columnId": "project-1753087049586-kxt00n020",
      "projectId": "project-1753087049586-kxt00n020",
      "kanbanColumnId": "col-1753087059503-fduqk083j",
      "reminderDate": "2025-07-30",
      "createdAt": "2025-07-21T08:37:51.580Z",
      "updatedAt": "2025-07-30T09:19:47.845Z",
      "position": 0,
      "linkedNotes": [],
      "dueDate": "2025-07-24"
    },
    {
      "id": "7e40d444-f3c3-4243-8e2f-20124a7e21d3",
      "title": "Mitarbeiterbefragung ausfÃ¼llen",
      "description": "[ðŸŒ Unique Employee Engagement 2025](https://forms.cloud.microsoft/Pages/ResponsePage.aspx?id=sBdzKcVJFEyWmfvIPOh89HCKotNAkulPuoBG8i_jb_tUREJNVlM2N0lRTlFCRDlWR05LREZWVDdWRi4u) (21.7.2025)",
      "completed": true,
      "estimatedTime": 30,
      "tags": [],
      "subtasks": [],
      "columnId": "date-2025-07-21",
      "dueDate": "2025-07-21",
      "reminderDate": "2025-07-21",
      "createdAt": "2025-07-21T08:39:39.587Z",
      "updatedAt": "2025-07-21T08:55:34.947Z",
      "position": 0,
      "linkedNotes": [],
      "trackedTime": 3.566666666666659,
      "completedAt": "2025-07-21T08:55:34.947Z"
    },
    {
      "id": "cb42c694-3339-40fa-840e-b3fee409be36",
      "title": "Sofia in Intrexx vorstellen",
      "description": "https://unique.zammad.com/#ticket/zoom/5084 heute",
      "completed": true,
      "estimatedTime": 20,
      "tags": [
        "ticket"
      ],
      "subtasks": [],
      "columnId": "date-2025-07-23",
      "dueDate": "2025-07-23",
      "reminderDate": "2025-07-23",
      "createdAt": "2025-07-23T10:00:24.503Z",
      "updatedAt": "2025-07-23T15:32:40.802Z",
      "position": 2,
      "linkedNotes": [],
      "archived": true
    },
    {
      "id": "726f544b-4950-4a29-ab49-c03fe2af6c5b",
      "title": "Field Computer MarlÃ¨ne",
      "description": "[UNIQUE Helpdesk](https://unique.zammad.com/#ticket/zoom/5050)",
      "completed": true,
      "estimatedTime": 15,
      "tags": [],
      "subtasks": [],
      "columnId": "date-2025-07-30",
      "createdAt": "2025-07-23T10:23:49.305Z",
      "updatedAt": "2025-07-30T14:28:50.243Z",
      "position": 7,
      "success": true,
      "task": {
        "title": "Field Computer MarlÃ¨ne",
        "tags": []
      },
      "errors": [],
      "suggestions": [
        "Tipp: Verwenden Sie ! fÃ¼r niedrige, !! fÃ¼r mittlere oder !!! fÃ¼r hohe PrioritÃ¤t",
        "Tipp: Verwenden Sie #tags zur Organisation (z.B. #arbeit, #privat)",
        "Tipp: Geben Sie eine ZeitschÃ¤tzung an (z.B. 30m, 1h, 90min)",
        "Tipp: Verwenden Sie @heute, @morgen oder @inbox zur expliziten Spalten-Zuordnung"
      ],
      "linkedNotes": [],
      "reminderDate": "2025-07-30"
    },
    {
      "id": "3b97658d-177a-4a16-9870-10e4ce729ab5",
      "title": "Abwesenheitsnachricht einstellen",
      "description": "",
      "completed": false,
      "priority": "high",
      "estimatedTime": 5,
      "tags": [
        "arbeit"
      ],
      "subtasks": [],
      "columnId": "date-2025-08-01",
      "reminderDate": "2025-08-01",
      "createdAt": "2025-07-30T08:20:25.817Z",
      "updatedAt": "2025-07-31T12:31:01.039Z",
      "position": 3,
      "trackedTime": 0,
      "linkedNotes": [],
      "projectId": "project-1752561187805-9xtzj8v39",
      "kanbanColumnId": "col-1752561731913-q9e4bm5aa",
      "dueDate": "2025-08-01"
    },
    {
      "id": "5395ccd6-a060-4f0a-91f7-f26025ef46bd",
      "title": "Intrexx: Erinnerungsmail an PL konfigurieren",
      "description": "",
      "completed": false,
      "priority": "medium",
      "estimatedTime": 20,
      "tags": [
        "arbeit"
      ],
      "subtasks": [],
      "columnId": "date-2025-08-01",
      "reminderDate": "2025-08-01",
      "createdAt": "2025-07-30T08:22:27.510Z",
      "updatedAt": "2025-07-31T12:31:01.039Z",
      "position": 7
    },
    {
      "id": "0e8e06d5-eb94-439d-a73e-d949b9ee6bd8",
      "title": "Mails durchgehen",
      "description": "",
      "completed": false,
      "estimatedTime": 30,
      "tags": [
        "arbeit"
      ],
      "subtasks": [],
      "columnId": "date-2025-08-01",
      "reminderDate": "2025-08-01",
      "createdAt": "2025-07-30T08:22:49.334Z",
      "updatedAt": "2025-07-31T12:31:01.039Z",
      "position": 0,
      "trackedTime": 23
    },
    {
      "id": "7e99c2dd-7954-4fc1-b71a-920716357fba",
      "title": "BBL vorbereiten",
      "description": "",
      "completed": true,
      "estimatedTime": 30,
      "tags": [],
      "subtasks": [],
      "columnId": "date-2025-07-30",
      "reminderDate": "2025-07-30",
      "createdAt": "2025-07-30T08:22:57.103Z",
      "updatedAt": "2025-07-30T14:28:50.243Z",
      "position": 0,
      "trackedTime": 4.899999999999988
    },
    {
      "id": "7232dcbd-ba3f-4693-ac1c-15fa2504c03b",
      "title": "Linux-Stick vorbereiten",
      "description": "",
      "completed": true,
      "estimatedTime": 15,
      "tags": [],
      "subtasks": [],
      "columnId": "date-2025-07-30",
      "reminderDate": "2025-07-30",
      "createdAt": "2025-07-30T08:54:25.970Z",
      "updatedAt": "2025-07-30T14:28:50.243Z",
      "position": 8
    },
    {
      "id": "b81bac57-dc14-4a16-b68b-bb559d04405e",
      "title": "Herrn Heitzmann (Sirius) antworten",
      "description": "[ðŸ“§ Mail](https://outlook.office.com/owa/?ItemID=AAkALgAAAAAAHYQDEapmEc2byACqAC%2FEWg0A3giTJBGu5Eanj%2B1b%2BQowoAAFUZfSiAAA&viewmodel=ReadMessageItem&path=&exvsurl=1) (30.7.2025)",
      "completed": false,
      "tags": [
        "arbeit"
      ],
      "subtasks": [],
      "columnId": "date-2025-08-01",
      "createdAt": "2025-07-30T09:01:29.357Z",
      "updatedAt": "2025-07-31T12:31:01.039Z",
      "position": 10
    },
    {
      "id": "8831b74d-069d-4399-97ea-84884b9d9592",
      "title": "Migration der DF-PostfÃ¤cher checken",
      "description": "[ðŸ“§ Mail](https://outlook.office.com/owa/?ItemID=AAkALgAAAAAAHYQDEapmEc2byACqAC%2FEWg0A3giTJBGu5Eanj%2B1b%2BQowoAAFUZcHvwAA&viewmodel=ReadMessageItem&path=&exvsurl=1) (30.7.2025)",
      "completed": false,
      "priority": "high",
      "tags": [
        "arbeit"
      ],
      "subtasks": [],
      "columnId": "date-2025-08-01",
      "createdAt": "2025-07-30T09:02:15.901Z",
      "updatedAt": "2025-07-31T12:31:01.039Z",
      "position": 1,
      "kanbanColumnId": "col-1752561188719-g4l45kms7",
      "reminderDate": "2025-08-01",
      "estimatedTime": 20,
      "linkedNotes": [],
      "dueDate": "2025-08-01"
    },
    {
      "id": "5e706ef2-abca-462f-97c6-d487c994ac8b",
      "title": "OpenAI-Rechnungen weiterleiten",
      "description": "[ðŸ“§ Mail](https://outlook.office.com/owa/?ItemID=AAkALgAAAAAAHYQDEapmEc2byACqAC%2FEWg0A3giTJBGu5Eanj%2B1b%2BQowoAAFUZcDFwAA&viewmodel=ReadMessageItem&path=&exvsurl=1) (30.7.2025)",
      "completed": false,
      "tags": [
        "arbeit"
      ],
      "subtasks": [],
      "columnId": "date-2025-08-01",
      "createdAt": "2025-07-30T09:03:00.988Z",
      "updatedAt": "2025-07-31T12:31:01.039Z",
      "position": 11
    },
    {
      "id": "32b99bb4-9d50-4308-90da-465abab5ff4a",
      "title": "Vodafone-Vertragslaufzeiten in Wiki eintragen",
      "description": "[ðŸ“§ Mail](https://outlook.office.com/owa/?ItemID=AAkALgAAAAAAHYQDEapmEc2byACqAC%2FEWg0A3giTJBGu5Eanj%2B1b%2BQowoAAFUZZ2rQAA&viewmodel=ReadMessageItem&path=&exvsurl=1) (30.7.2025)",
      "completed": false,
      "tags": [],
      "subtasks": [],
      "columnId": "project-1752561187805-9xtzj8v39",
      "createdAt": "2025-07-30T09:23:08.309Z",
      "updatedAt": "2025-07-31T12:27:31.610Z",
      "position": 2,
      "kanbanColumnId": "col-1752561188719-g4l45kms7"
    },
    {
      "id": "549d6288-b43d-4bab-afbc-1c72dda04dca",
      "title": "KlÃ¤rung von KI-Nutzung - AVV-VertrÃ¤ge mit Gero Wilke",
      "description": "[ðŸ“§ Mail](https://outlook.office.com/owa/?ItemID=AAkALgAAAAAAHYQDEapmEc2byACqAC%2FEWg0A3giTJBGu5Eanj%2B1b%2BQowoAAFTWJwvwAA&viewmodel=ReadMessageItem&path=&exvsurl=1) (30.7.2025)",
      "completed": false,
      "tags": [],
      "subtasks": [],
      "columnId": "project-1752561187805-9xtzj8v39",
      "createdAt": "2025-07-30T09:35:17.309Z",
      "updatedAt": "2025-07-31T12:27:31.610Z",
      "position": 3,
      "kanbanColumnId": "col-1752561188719-g4l45kms7"
    },
    {
      "id": "055d7735-c239-49b9-a494-a1ab1d53767f",
      "title": "Visitenkarten bestellen",
      "description": "[ðŸ“§ Mail](https://outlook.office.com/owa/?ItemID=AAkALgAAAAAAHYQDEapmEc2byACqAC%2FEWg0A3giTJBGu5Eanj%2B1b%2BQowoAAFTWHTSgAA&viewmodel=ReadMessageItem&path=&exvsurl=1) (30.7.2025)",
      "completed": false,
      "priority": "medium",
      "tags": [
        "arbeit"
      ],
      "subtasks": [],
      "columnId": "date-2025-08-01",
      "kanbanColumnId": "col-1752561188719-g4l45kms7",
      "createdAt": "2025-07-30T09:37:46.930Z",
      "updatedAt": "2025-07-31T12:31:01.039Z",
      "position": 4,
      "reminderDate": "2025-08-01",
      "estimatedTime": 20,
      "linkedNotes": [],
      "dueDate": "2025-08-01"
    },
    {
      "id": "c85aff20-07f6-4e67-88f2-c151f6f5381c",
      "title": "Stefanie Scherle antworten",
      "description": "[ðŸ“§ Mail](https://outlook.office.com/owa/?ItemID=AAkALgAAAAAAHYQDEapmEc2byACqAC%2FEWg0A3giTJBGu5Eanj%2B1b%2BQowoAAFTWCCyAAA&viewmodel=ReadMessageItem&path=&exvsurl=1) (30.7.2025)",
      "completed": false,
      "tags": [
        "arbeit"
      ],
      "subtasks": [],
      "columnId": "date-2025-08-01",
      "createdAt": "2025-07-30T09:39:56.500Z",
      "updatedAt": "2025-07-31T12:31:01.039Z",
      "position": 12
    },
    {
      "id": "e1f0c14a-a5a3-4739-ad54-c4e6b085afc8",
      "title": "Einbindung TrendMicro klÃ¤ren",
      "description": "[ðŸ“§ Mail](https://outlook.office.com/owa/?ItemID=AAkALgAAAAAAHYQDEapmEc2byACqAC%2FEWg0A3giTJBGu5Eanj%2B1b%2BQowoAAFTWAbOgAA&viewmodel=ReadMessageItem&path=&exvsurl=1) (30.7.2025) morgen",
      "completed": false,
      "estimatedTime": 10,
      "tags": [
        "arbeit"
      ],
      "subtasks": [],
      "columnId": "date-2025-08-01",
      "dueDate": "2025-07-31",
      "reminderDate": "2025-08-01",
      "createdAt": "2025-07-30T09:40:58.866Z",
      "updatedAt": "2025-07-31T12:31:01.039Z",
      "position": 8,
      "linkedNotes": []
    },
    {
      "id": "b69f59d6-56b7-4e43-9ace-2b4de84fa9bf",
      "title": "RÃ¼ckmeldung an Daniel HÃ¶se / Dataciders",
      "description": "[ðŸ“§ Mail](https://outlook.office.com/owa/?ItemID=AAkALgAAAAAAHYQDEapmEc2byACqAC%2FEWg0A3giTJBGu5Eanj%2B1b%2BQowoAAFTUkHQQAA&viewmodel=ReadMessageItem&path=&exvsurl=1) (30.7.2025)",
      "completed": false,
      "tags": [
        "arbeit"
      ],
      "subtasks": [],
      "columnId": "date-2025-08-01",
      "createdAt": "2025-07-30T09:46:56.278Z",
      "updatedAt": "2025-07-31T12:31:01.039Z",
      "position": 13,
      "reminderDate": "2025-08-01",
      "linkedNotes": [],
      "projectId": "project-1752561187805-9xtzj8v39",
      "kanbanColumnId": "col-1752561731913-q9e4bm5aa",
      "dueDate": "2025-08-01"
    },
    {
      "id": "51092171-66e6-4532-bf3d-37cc65499fd3",
      "title": "Bild von Diana sichern",
      "description": "ist in Nextcloud",
      "completed": false,
      "priority": "high",
      "estimatedTime": 10,
      "tags": [
        "arbeit"
      ],
      "subtasks": [],
      "columnId": "date-2025-08-01",
      "dueDate": "2025-08-01",
      "reminderDate": "2025-08-01",
      "createdAt": "2025-07-31T12:26:34.816Z",
      "updatedAt": "2025-07-31T12:31:01.039Z",
      "position": 2,
      "linkedNotes": []
    },
    {
      "id": "2edc4389-9fd2-4aa6-bf1f-2ceef74fea06",
      "title": "FahrradstÃ¤nder kaufen",
      "description": "25cm LÃ¤nge",
      "completed": false,
      "priority": "medium",
      "tags": [
        "privat"
      ],
      "subtasks": [],
      "columnId": "date-2025-07-31",
      "dueDate": "2025-07-31",
      "reminderDate": "2025-07-31",
      "createdAt": "2025-07-31T13:46:38.964Z",
      "updatedAt": "2025-07-31T13:47:33.548Z",
      "position": 1753969598964,
      "linkedNotes": []
    }
  ],
  "columns": [
    {
      "id": "date-2025-07-31",
      "title": "31.07.2025",
      "type": "date",
      "date": "2025-07-31",
      "order": 1,
      "tasks": []
    },
    {
      "id": "date-2025-08-01",
      "title": "01.08.2025",
      "type": "date",
      "date": "2025-08-01",
      "order": 2,
      "tasks": []
    },
    {
      "id": "date-2025-08-02",
      "title": "02.08.2025",
      "type": "date",
      "date": "2025-08-02",
      "order": 3,
      "tasks": []
    },
    {
      "id": "date-2025-08-03",
      "title": "03.08.2025",
      "type": "date",
      "date": "2025-08-03",
      "order": 4,
      "tasks": []
    },
    {
      "id": "date-2025-08-04",
      "title": "04.08.2025",
      "type": "date",
      "date": "2025-08-04",
      "order": 5,
      "tasks": []
    },
    {
      "id": "date-2025-08-05",
      "title": "05.08.2025",
      "type": "date",
      "date": "2025-08-05",
      "order": 6,
      "tasks": []
    },
    {
      "id": "date-2025-08-06",
      "title": "06.08.2025",
      "type": "date",
      "date": "2025-08-06",
      "order": 7,
      "tasks": []
    },
    {
      "id": "date-2025-08-07",
      "title": "07.08.2025",
      "type": "date",
      "date": "2025-08-07",
      "order": 8,
      "tasks": []
    },
    {
      "id": "date-2025-08-08",
      "title": "08.08.2025",
      "type": "date",
      "date": "2025-08-08",
      "order": 9,
      "tasks": []
    },
    {
      "id": "date-2025-08-09",
      "title": "09.08.2025",
      "type": "date",
      "date": "2025-08-09",
      "order": 10,
      "tasks": []
    },
    {
      "id": "date-2025-08-10",
      "title": "10.08.2025",
      "type": "date",
      "date": "2025-08-10",
      "order": 11,
      "tasks": []
    },
    {
      "id": "date-2025-08-11",
      "title": "11.08.2025",
      "type": "date",
      "date": "2025-08-11",
      "order": 12,
      "tasks": []
    },
    {
      "id": "date-2025-08-12",
      "title": "12.08.2025",
      "type": "date",
      "date": "2025-08-12",
      "order": 13,
      "tasks": []
    },
    {
      "id": "date-2025-08-13",
      "title": "13.08.2025",
      "type": "date",
      "date": "2025-08-13",
      "order": 14,
      "tasks": []
    },
    {
      "id": "date-2025-08-14",
      "title": "14.08.2025",
      "type": "date",
      "date": "2025-08-14",
      "order": 15,
      "tasks": []
    },
    {
      "id": "date-2025-08-15",
      "title": "15.08.2025",
      "type": "date",
      "date": "2025-08-15",
      "order": 16,
      "tasks": []
    },
    {
      "id": "date-2025-08-16",
      "title": "16.08.2025",
      "type": "date",
      "date": "2025-08-16",
      "order": 17,
      "tasks": []
    },
    {
      "id": "date-2025-08-17",
      "title": "17.08.2025",
      "type": "date",
      "date": "2025-08-17",
      "order": 18,
      "tasks": []
    },
    {
      "id": "date-2025-08-18",
      "title": "18.08.2025",
      "type": "date",
      "date": "2025-08-18",
      "order": 19,
      "tasks": []
    },
    {
      "id": "date-2025-08-19",
      "title": "19.08.2025",
      "type": "date",
      "date": "2025-08-19",
      "order": 20,
      "tasks": []
    },
    {
      "id": "date-2025-08-20",
      "title": "20.08.2025",
      "type": "date",
      "date": "2025-08-20",
      "order": 21,
      "tasks": []
    },
    {
      "id": "date-2025-08-21",
      "title": "21.08.2025",
      "type": "date",
      "date": "2025-08-21",
      "order": 22,
      "tasks": []
    },
    {
      "id": "date-2025-08-22",
      "title": "22.08.2025",
      "type": "date",
      "date": "2025-08-22",
      "order": 23,
      "tasks": []
    },
    {
      "id": "date-2025-08-23",
      "title": "23.08.2025",
      "type": "date",
      "date": "2025-08-23",
      "order": 24,
      "tasks": []
    },
    {
      "id": "date-2025-08-24",
      "title": "24.08.2025",
      "type": "date",
      "date": "2025-08-24",
      "order": 25,
      "tasks": []
    },
    {
      "id": "date-2025-08-25",
      "title": "25.08.2025",
      "type": "date",
      "date": "2025-08-25",
      "order": 26,
      "tasks": []
    },
    {
      "id": "date-2025-08-26",
      "title": "26.08.2025",
      "type": "date",
      "date": "2025-08-26",
      "order": 27,
      "tasks": []
    },
    {
      "id": "date-2025-08-27",
      "title": "27.08.2025",
      "type": "date",
      "date": "2025-08-27",
      "order": 28,
      "tasks": []
    },
    {
      "id": "date-2025-08-28",
      "title": "28.08.2025",
      "type": "date",
      "date": "2025-08-28",
      "order": 29,
      "tasks": []
    },
    {
      "id": "date-2025-08-29",
      "title": "29.08.2025",
      "type": "date",
      "date": "2025-08-29",
      "order": 30,
      "tasks": []
    },
    {
      "id": "project-1752481231598-z9g5g889y",
      "title": "Wissenstag",
      "type": "project",
      "order": 0,
      "tasks": [],
      "linkedNotes": [
        "1753252738490v4xdxvdua"
      ]
    },
    {
      "id": "project-1752561187805-9xtzj8v39",
      "title": "Aufgaben",
      "type": "project",
      "order": 1,
      "tasks": []
    },
    {
      "id": "project-1753087049586-kxt00n020",
      "title": "Canopea",
      "type": "project",
      "order": 2,
      "tasks": []
    }
  ],
  "tags": [
    {
      "id": "tag-arbeit",
      "name": "arbeit",
      "color": "#6b7280",
      "count": 15
    },
    {
      "id": "tag-canopea",
      "name": "canopea",
      "color": "#6b7280",
      "count": 1
    },
    {
      "id": "tag-ticket",
      "name": "ticket",
      "color": "#6b7280",
      "count": 1
    },
    {
      "id": "tag-privat",
      "name": "privat",
      "color": "#6b7280",
      "count": 1
    }
  ],
  "notes": {
    "notes": [
      {
        "id": "1752561253685v0yk2nn82",
        "title": "VorstellungsgesprÃ¤ch Naheed",
        "content": "- Briefly introduce myself and explain that I am the IT manager\n- Ask how they would like to be addressed\n- Ask them to briefly introduce themselves\n\n\nAmong other things, I am responsible for our internal infrastructure, IT security, data protection issues, and supporting our end devices (laptops for employees). We provide IT for our employees and also develop some solutions for specialist departments and projects. Among other things, we have started to develop applications (expert database, calculation aid for travel times, insurance management software, etc.) and develop tailor-made AI solutions for projects and project work.\n\nThere are currently two of us in our IT department. Besides me, there is Ashik, who provides first-level support and develops applications.\n \nIT security is a well-known topic for you. Banking sector and genomics\n\n\nWe work in accordance with BSI standards and ISO 27001.\n\nIf you are hired, you will work with us in various areas. Part of your working time will be spent in internal IT.\n- Linux server support and Linux desktops\n- Coordination of security risks, emergency planning, and GDPR implementation.\n\nI am particularly interested in how you work in these areas and where you see yourself â€“ both technically and in terms of collaboration with other teams.\n\n- Which Linux distribution do you prefer for servers? In CV: redhat and Debian. Why?\n- How do you deal with distribution updates and upgrades? What do you do if security vulnerabilities are known but an update/upgrade is not currently possible?\n- Do you have experience with server virtualization via Proxmox?\n\n- Have you had any contact with data protection requirements in previous projects? Can you give an example?\n- How do you handle the storage and processing of personal data?\n- What measures would you take to ensure that data transfers are GDPR-compliant?\n- Are you familiar with the most important principles of the GDPR? (Lawfulness, processing in good faith, transparency, purpose limitation, data minimization, integrity and confidentiality, accountability\n\n- How do you assess the risk of a new application or architecture?\n- Do you have experience in creating emergency or recovery plans?\n- Are you familiar with the most important elements of a security concept?\n- How do you document security measures so that they remain traceable for others?\n- Do you have experience with backup strategies for large amounts of data (> TB range)?\n- Have you ever been involved in ISO 27001 certification?\n- How do you document technical and organizational measures (TOM)?\n- Describe a project that went wrong. What did you learn from it?\n\n- Are there any topics that would be particularly important to you if you started here?\n- Do you have any questions?\n",
        "tags": [
          "devops"
        ],
        "linkedTasks": [
          "2ffe85b2-c104-4ecc-bdba-6208d6f29651"
        ],
        "linkedNotes": [],
        "pinned": true,
        "archived": true,
        "createdAt": "2025-07-15T06:34:13.685Z",
        "updatedAt": "2025-07-23T15:02:32.719Z"
      },
      {
        "id": "1753252738490v4xdxvdua",
        "title": "TaskFuchs-Entwicklung",
        "content": "# Ideen\n- [ ] Umschaltung des Editors zu WYSIWYG\n- [ ] Pexels-Einbindung mit API.\n- [X] CalDAV-Sync: Sync-Intervall festlegen.\n- [X] Notizen bearbeiten: Button \"In Notizen Ã¶ffnen\" funktioniert nicht.\n- [X] Bei Smart-Parsing: Wichtigkeit bleibt im Aufgabennamen bestehen. So steht z.B. im Aufgabennamen !!! bei sehr wichtig. GewÃ¼nschtes Verhalten: Wenn WIchtigkeit geparst ist, sollen die Ausrufezeichen aus dem Aufgabennamen verschwinden.\n- [X] Wenn Aufgabe mit Datum Ã¼ber Smart-Parsing hinzugefÃ¼gt wurde, darf sie nicht in \"Eingang\" landen, sondern in der entsprechenden Datumsspalte in Planer. Sie muss das Datum zugewiesen bekommen.\n- [ ] Wenn eine Aufgabenbeschreibung eine URL beinhaltet, die mit [UNIQUE Helpdesk](https://unique.zammad.com/#ticket) beginnt, dann weise der Aufgabe automatisch den Tag #ticket zu.\n\n\n# Bugs\n- [X] Tag-Verwaltung: Manche Tags lassen sich nicht lÃ¶schen. Alle Tags sollen lÃ¶schbar sein.\n- [x] Filterliste im Header in Notizen Ã¶ffnet nicht\n- [x] In NOtizen: In rechter SPalte: Keine Anzeige von \"Keine Tags\", \"Keine verknÃ¼pften Aufgaben\", \"Keine VerknÃ¼pften Projekte\" Wenn eh nichts zu sehen ist. Erst VerknÃ¼pfungen anzeigen, wenn vorhanden.\n- [ ] In MD-Editor: Aufgabenelemente schreiben sich nicht automatisch fort. Wenn ich eine Zeile, die mit - [ ] beginnt mit ENTER beende, soll die nÃ¤chste Zeile mit - [ ] beginnen.\n- [X] Planer und Projekte: Tabellenspalten sind nicht scrollbar. Man kann aktuell nicht nach unten scrollen. Fixe das. Scrollbar soll nicht angezeigt werden.\n- [X] Projekte: Bei laufendem Timer lassen sich Aufgaben nicht archivieren.\n- [X] Planer: Filter nach Tag funktioniert nicht. Es werden Tags angezeigt, die gar nicht mehr vorkommen, etwa weil die Aufgabe nicht mehr vorhanden ist.\n- [ ] Checklisten lassen sich nicht abhaken\n---\n\n# Huntergrundbilder\n![pexels photo 32767147](https://images.pexels.com/photos/32767147/pexels-photo-32767147.jpeg?_gl=1*r1lq9g*_ga*Nzg4MTMzMzk4LjE3NTMyOTk2NjU.*_ga_8JE65Q40S6*czE3NTMyOTk2NjUkbzEkZzEkdDE3NTMyOTk3NjckajE5JGwwJGgw)\n\n# Notizen\n**Kalenderfreigabe**\n>https://outlook.office365.com/owa/calendar/55a7744a282c437a836eb3dad44c6709@unique-landuse.de/25a0968e13534bc195ceb38e5beddc4b1348024555792318342/S-1-8-3574032643-298043167-3273186133-1683214480/reachcalendar.ics",
        "tags": [],
        "linkedTasks": [],
        "linkedNotes": [],
        "linkedProjects": [],
        "pinned": true,
        "archived": false,
        "createdAt": "2025-07-23T06:38:58.490Z",
        "updatedAt": "2025-07-24T07:05:50.142Z"
      },
      {
        "id": "1753255557504pkwrhqb79",
        "title": "Mittwoch, 23. Juli 2025",
        "content": "# Mittwoch, 23. Juli 2025\n\n",
        "tags": [
          "daily"
        ],
        "linkedTasks": [],
        "linkedNotes": [],
        "linkedProjects": [],
        "pinned": false,
        "archived": false,
        "createdAt": "2025-07-23T07:25:57.504Z",
        "updatedAt": "2025-07-23T07:25:57.504Z",
        "dailyNote": true,
        "dailyNoteDate": "2025-07-23"
      },
      {
        "id": "1753270651558n86mkwp9g",
        "title": "VorstellunggesprÃ¤ch JittaHanumesh",
        "content": "- Briefly introduce myself and explain that I am the IT manager\n\n## Intrduction\nAmong other things, I am responsible for our internal infrastructure, IT security, data protection issues, and supporting our end devices (laptops for employees). We provide IT for our employees and also develop some solutions for specialist departments and projects. Among other things, we have started to develop applications (expert database, calculation aid for travel times, insurance management software, etc.) and develop tailor-made AI solutions for projects and project work.\nWe work in accordance with BSI standards and ISO 27001.\n\nThere are currently two of us in our IT department. Besides me, there is Ashik, who provides first-level support and develops applications.\n \nIf you are hired, you will work with us in various areas. Part of your working time will be spent in internal IT.\n- Linux server support and Linux desktops\n- Coordination of security risks, emergency planning, and GDPR implementation.\n\nI am particularly interested in how you work in these areas and where you see yourself â€“ both technically and in terms of collaboration with other teams.\n\n- Could you briefly describe your technuical skills concerning Windows and Linux?\n- Any experiences with Debian based systems??\n- Do you have experience with server virtualization via Proxmox? - Knows VMWare\n- How do you deal with distribution updates and upgrades? What do you do if security vulnerabilities are known but an update/upgrade is not currently possible?\n\n\n- Have you had any contact with data protection requirements in previous projects? Can you give an example?\n- Are you familiar with the most important principles of the GDPR? (Lawfulness, processing in good faith, transparency, purpose limitation, data minimization, integrity and confidentiality, accountability\n- How do you handle the storage and processing of personal data? Are you aware of the special requirements of treting sensitive data?\n- Do you have experience in creating emergency or recovery plans?\n- Are you familiar with the most important elements of a security concept?\n- How do you document security measures so that they remain traceable for others?\n- Do you have experience with backup strategies for large amounts of data (> TB range)?\n- Have you ever been involved in ISO 27001 certification?\n- How do you document technical and organizational measures (TOM)?\n- Describe a project that went wrong. What did you learn from it?\n\n- Are there any topics that would be particularly important to you if you started here?\n- Do you have any questions?\n",
        "tags": [
          "devops"
        ],
        "linkedTasks": [],
        "linkedNotes": [],
        "linkedProjects": [],
        "pinned": false,
        "archived": true,
        "createdAt": "2025-07-23T11:37:31.558Z",
        "updatedAt": "2025-07-23T15:02:40.017Z"
      },
      {
        "id": "17533005205792t3mxf2wb",
        "title": "Hintergrundbilder fÃ¼",
        "content": "",
        "tags": [],
        "linkedTasks": [],
        "linkedNotes": [],
        "linkedProjects": [],
        "pinned": false,
        "archived": true,
        "createdAt": "2025-07-23T19:55:20.579Z",
        "updatedAt": "2025-07-23T19:55:29.070Z"
      },
      {
        "id": "1753868924485969kvl9um",
        "title": "Unbenannte Notiz",
        "content": "![image.png](storage://img_1753871182879_zykbl7lei)",
        "tags": [],
        "linkedTasks": [
          "e83aadf1-5057-43e7-899d-9d0d768ff004"
        ],
        "linkedNotes": [],
        "linkedProjects": [],
        "pinned": false,
        "archived": true,
        "createdAt": "2025-07-30T09:48:44.485Z",
        "updatedAt": "2025-07-30T10:26:24.887Z"
      },
      {
        "id": "17538712546469q5y2ou89",
        "title": "Mittwoch, 30. Juli 2025",
        "content": "# Mittwoch, 30. Juli 2025\n\n",
        "tags": [
          "daily"
        ],
        "linkedTasks": [],
        "linkedNotes": [],
        "linkedProjects": [],
        "pinned": false,
        "archived": false,
        "createdAt": "2025-07-30T10:27:34.646Z",
        "updatedAt": "2025-07-30T10:27:34.646Z",
        "dailyNote": true,
        "dailyNoteDate": "2025-07-30"
      }
    ],
    "selectedNote": null,
    "isEditing": false,
    "searchQuery": "",
    "selectedTags": [],
    "view": "grid",
    "sortBy": "updated",
    "sortOrder": "desc",
    "showArchived": false,
    "showLinkPreviews": true,
    "editorMode": "split",
    "dailyNotesMode": false,
    "emailMode": false,
    "selectedDailyNoteDate": null
  },
  "archivedTasks": [
    {
      "id": "b1f09e4a-9cb8-43c6-904a-c7dcbd013a56",
      "title": "Guthaben uwiki aufladen",
      "description": "[ðŸ“§ Mail](https://outlook.office.com/owa/?ItemID=AAkALgAAAAAAHYQDEapmEc2byACqAC%2FEWg0A3giTJBGu5Eanj%2B1b%2BQowoAAFR3EwPQAA&viewmodel=ReadMessageItem&path=&exvsurl=1) (15.7.2025)",
      "completed": true,
      "priority": "high",
      "estimatedTime": 10,
      "tags": [],
      "subtasks": [],
      "columnId": "date-2025-07-22",
      "reminderDate": "2025-07-22",
      "createdAt": "2025-07-15T11:51:49.965Z",
      "updatedAt": "2025-07-22T09:47:47.991Z",
      "position": 0,
      "linkedNotes": [],
      "trackedTime": 4.466666666666656,
      "completedAt": "2025-07-22T08:13:44.778Z"
    },
    {
      "id": "9c56db1a-aa04-4ebb-b433-b3a52b1fe450",
      "title": "DeepL abrechnen",
      "description": "[ðŸ“§ Mail](https://outlook.office.com/owa/?ItemID=AAkALgAAAAAAHYQDEapmEc2byACqAC%2FEWg0A3giTJBGu5Eanj%2B1b%2BQowoAAFR3EPIAAA&viewmodel=ReadMessageItem&path=&exvsurl=1) (15.7.2025)",
      "completed": true,
      "estimatedTime": 10,
      "tags": [],
      "subtasks": [],
      "columnId": "date-2025-07-22",
      "reminderDate": "2025-07-22",
      "createdAt": "2025-07-15T11:52:36.195Z",
      "updatedAt": "2025-07-22T09:47:47.991Z",
      "position": 2,
      "linkedNotes": [],
      "trackedTime": 4.4499999999999895,
      "completedAt": "2025-07-22T08:46:48.018Z"
    },
    {
      "id": "2f1351c4-84d9-4413-8ce6-84e8019f15a5",
      "title": "Cursor abrechnen",
      "description": "",
      "completed": true,
      "priority": "medium",
      "estimatedTime": 35,
      "tags": [],
      "subtasks": [],
      "columnId": "date-2025-07-22",
      "reminderDate": "2025-07-22",
      "createdAt": "2025-07-15T11:52:54.890Z",
      "updatedAt": "2025-07-22T09:47:47.991Z",
      "position": 1,
      "trackedTime": 26.699999999999765
    },
    {
      "id": "779f00f6-62cc-44de-af6c-e432d6db2772",
      "title": "Stunden Olivier prÃ¼fen",
      "description": "",
      "completed": true,
      "priority": "high",
      "estimatedTime": 25,
      "tags": [],
      "subtasks": [],
      "columnId": "date-2025-07-22",
      "reminderDate": "2025-07-22",
      "createdAt": "2025-07-15T11:54:27.555Z",
      "updatedAt": "2025-07-22T09:47:47.991Z",
      "position": 3,
      "linkedNotes": [],
      "reminderTime": "14:44",
      "trackedTime": 30.699999999999537
    },
    {
      "id": "a18c3930-d5b0-4519-bf38-80a1783f5fad",
      "title": "Auf Mail von Johannes reagieren",
      "description": "",
      "completed": true,
      "priority": "high",
      "estimatedTime": 20,
      "tags": [],
      "subtasks": [],
      "columnId": "date-2025-07-22",
      "reminderDate": "2025-07-22",
      "createdAt": "2025-07-22T08:02:00.748Z",
      "updatedAt": "2025-07-22T09:47:47.991Z",
      "position": 4,
      "trackedTime": 20,
      "completedAt": "2025-07-22T09:47:37.485Z"
    },
    {
      "id": "175c62eb-9017-4c63-9738-90e7ce91256a",
      "title": "Stundenbuchtung von Alwin Ã¶ffnen",
      "description": "ðŸŽ« UNIQUE Helpdesk - - FW: Benjamin hat eine Nachricht gesendet. (23.7.2025)\n\nðŸ”— https://unique.zammad.com/#ticket/zoom/5085",
      "completed": true,
      "priority": "medium",
      "estimatedTime": 0,
      "tags": [
        "ticket"
      ],
      "subtasks": [],
      "columnId": "date-2025-07-24",
      "dueDate": "2025-07-23",
      "reminderDate": "2025-07-24",
      "createdAt": "2025-07-23T09:52:23.806Z",
      "updatedAt": "2025-07-24T07:56:45.628Z",
      "position": 0,
      "linkedNotes": []
    },
    {
      "id": "bef541c2-d919-46db-addc-21fc2f92e7b4",
      "title": "Zeiterfassung Prapa Ã¶ffnen",
      "description": "ðŸŽ« UNIQUE Helpdesk - - Intrexx time records (23.7.2025)\n\nðŸ”— https://unique.zammad.com/#ticket/zoom/5069",
      "completed": true,
      "estimatedTime": 10,
      "tags": [
        "ticket"
      ],
      "subtasks": [],
      "columnId": "date-2025-07-24",
      "dueDate": "2025-07-24",
      "reminderDate": "2025-07-24",
      "createdAt": "2025-07-23T09:56:18.564Z",
      "updatedAt": "2025-07-24T08:09:42.884Z",
      "position": 2,
      "linkedNotes": [],
      "trackedTime": 5.099999999999987
    },
    {
      "id": "2a0bc8d9-03d0-49a0-8b4b-8f6d062848c7",
      "title": "Stundenbuchung Patricia Holter Ã¶ffnen",
      "description": "[UNIQUE Helpdesk](https://unique.zammad.com/#ticket/zoom/5070)",
      "completed": true,
      "estimatedTime": 5,
      "tags": [
        "ticket"
      ],
      "subtasks": [],
      "columnId": "date-2025-07-24",
      "dueDate": "2025-07-24",
      "reminderDate": "2025-07-24",
      "createdAt": "2025-07-23T10:07:11.416Z",
      "updatedAt": "2025-07-24T08:04:17.383Z",
      "position": 1,
      "linkedNotes": []
    },
    {
      "id": "61886515-de45-4100-a34f-cfbc49fe0bfc",
      "title": "Stundenbuchung Janne Ã¶ffnen",
      "description": "https://unique.zammad.com/#ticket/zoom/5057 heute",
      "completed": true,
      "estimatedTime": 5,
      "tags": [
        "ticket"
      ],
      "subtasks": [],
      "columnId": "date-2025-07-24",
      "dueDate": "2025-07-23",
      "reminderDate": "2025-07-24",
      "createdAt": "2025-07-23T10:08:46.796Z",
      "updatedAt": "2025-07-24T08:11:22.867Z",
      "position": 3,
      "linkedNotes": []
    },
    {
      "id": "b5066c26-57f3-4ea4-8a61-9f4a23fa16f6",
      "title": "KlÃ¤rung Ãœbernahme LinkedIn-Account",
      "description": "https://unique.zammad.com/#ticket/zoom/5058",
      "completed": true,
      "tags": [],
      "subtasks": [],
      "columnId": "date-2025-07-31",
      "createdAt": "2025-07-14T08:17:35.895Z",
      "updatedAt": "2025-07-31T12:27:24.502Z",
      "position": 0,
      "kanbanColumnId": "col-1752561672157-g38e1xha4",
      "reminderDate": "2025-07-31",
      "estimatedTime": 10,
      "linkedNotes": [],
      "dueDate": "2025-07-30",
      "projectId": "project-1752561187805-9xtzj8v39"
    },
    {
      "id": "1fa7b0da-7bbc-4aed-849c-407f994eec1b",
      "title": "Angebot von Lukas weiterleiten und Kalkulation",
      "description": "[ðŸ“§ Mail von Lukas](https://outlook.office.com/owa/?ItemID=AAkALgAAAAAAHYQDEapmEc2byACqAC%2FEWg0A3giTJBGu5Eanj%2B1b%2BQowoAAFUZafcQAA&viewmodel=ReadMessageItem&path=&exvsurl=1) (30.7.2025)\n\n[ðŸ“§ Mail von Johannes](https://outlook.office.com/owa/?ItemID=AAkALgAAAAAAHYQDEapmEc2byACqAC%2FEWg0A3giTJBGu5Eanj%2B1b%2BQowoAAFT7L2ngAA&viewmodel=ReadMessageItem&path=&exvsurl=1) (30.7.2025)",
      "completed": true,
      "priority": "high",
      "estimatedTime": 15,
      "tags": [],
      "subtasks": [],
      "columnId": "date-2025-07-31",
      "dueDate": "2025-07-30",
      "reminderDate": "2025-07-31",
      "createdAt": "2025-07-30T08:19:53.030Z",
      "updatedAt": "2025-07-31T12:27:24.502Z",
      "position": 1,
      "linkedNotes": [],
      "projectId": "project-1752561187805-9xtzj8v39",
      "kanbanColumnId": "col-1752561672157-g38e1xha4"
    },
    {
      "id": "a156b34d-6774-403f-9fd3-6f437ec9220d",
      "title": "Folien fÃ¼r MM-Meeting vorbereiten",
      "description": "[ðŸ“§ Mail](https://outlook.office.com/owa/?ItemID=AAkALgAAAAAAHYQDEapmEc2byACqAC%2FEWg0A3giTJBGu5Eanj%2B1b%2BQowoAAFUZb%2BrwAA&viewmodel=ReadMessageItem&path=&exvsurl=1) (30.7.2025)",
      "completed": true,
      "priority": "high",
      "tags": [],
      "subtasks": [],
      "columnId": "date-2025-07-31",
      "reminderDate": "2025-07-31",
      "createdAt": "2025-07-30T09:19:35.873Z",
      "updatedAt": "2025-07-31T12:27:24.502Z",
      "position": 2,
      "linkedNotes": [],
      "projectId": "project-1752561187805-9xtzj8v39",
      "kanbanColumnId": "col-1752561672157-g38e1xha4",
      "dueDate": "2025-07-30"
    }
  ],
  "pinColumns": [
    {
      "id": "default-pin",
      "title": "Pin",
      "color": "#64748b",
      "order": 0,
      "createdAt": "2025-07-31T18:15:50.906Z",
      "updatedAt": "2025-07-31T18:15:50.906Z"
    }
  ],
  "exportDate": "2025-07-31T19:33:46.436Z",
  "version": "1.0"
}